Temple Name,latitude,longitude,City,state,Country,Description,Website,Email,Phone,Google Maps Link,Image URLs
Hatakeshwaram,16.0534177,78.8886378,Srisailam,Andhra Pradesh,India,"The present temple dedicated to Hatakeswara Swamy is stone structure built around 12th century. Timings of Hathakesvara Temple, Srisailam: Hatakeswaram Temple Timings are from 6 AM to 9 PM, it is open on all days of the week. Hathakesvara Temple Srisailam Address: Srisailam Project Township, Srisailam, Andhra Pradesh, 518101, India",https://www.templetimings.com/hatekeswaram-srisailam/,,,https://www.google.com/maps/search/?api=1&query=Hatakeshwaram%20Srisailam%20temple,"https://i1.wp.com/hindupad.com/wp-content/uploads/Hatakeswaram-Temple-no-watermark.jpg?fit=624,416, https://www.templetimings.com/wp-content/uploads/2018/08/HATEKESWARAM-SRISAILAM.jpg"
Saibaba Temple,15.4509221,80.1173607,Alluru Aakula,Andhra Pradesh,India,"For Real Time Official Live Darshan of Shree Sai Baba Samadhi Mandir, Shirdi Click here. About. Shree Saibaba Sansthan Trust, Shirdi, ... Temples in Premise. More. Shirdi Nearby Places. More. Daily Programme. 4:45 AM: Temple Open: 5:00 AM: Bhupali: 5:15 AM: Kakad Aarti (Morning) 5:50 AM: Mangal Snaan In Samadhi Mandir:",https://sai.org.in/,,,https://www.google.com/maps/search/?api=1&query=Saibaba%20Temple%20Alluru%20Aakula%20temple,"https://new-img.patrika.com/upload/2023/01/07/shirdi_saibaba_temple.jpg, https://www.templetimings.com/wp-content/uploads/2018/09/Shirdi-Saibaba-Temple.png"
"Ranganatha Swamy temple, Peravali",15.2871842,77.5003161,Peravali,Andhra Pradesh,India,"The Peravali Ranganatha Swami Temple, In the Kurnool district of Andhra Pradesh, there is a revered Hindu temple dedicated to Lord Ranganatha, a reclining form of Lord Vishnu. Known for its rich history, spiritual significance, and stunning Dravidian architecture, this temple is a must-visit for devotees and history enthusiasts alike.",https://hindutone.com/temples/peravali-sri-ranganatha-swamy-temple-history-timings-festivals-travel-guide/,,,https://www.google.com/maps/search/?api=1&query=Ranganatha%20Swamy%20temple%2C%20Peravali%20Peravali%20temple,"https://hindutone.com/wp-content/uploads/2025/02/Peravali-Sri-Ranganatha-Swamy-Temple-1-768x473.jpg, https://i.pinimg.com/originals/9b/df/39/9bdf393f1c40c73b72972558bcb581cf.jpg"
Ramalayam,15.7509149,79.7771064,Papireddipalem,Andhra Pradesh,India,"Dichpally Ramalayam is a Lord Rama temple located in Dichpally Village of Nizamabad, ... This is also called Khilla Ramalayam [1] Architecture. Temple was built of black and white basalt stone, with the finest architecture and excellent craftsmanship of goddesses, animals, devils and Khajuraho style erotic structures on it. This ancient temple ...",https://en.wikipedia.org/wiki/Dichpally_Ramalayam,,,https://www.google.com/maps/search/?api=1&query=Ramalayam%20Papireddipalem%20temple,"https://2.bp.blogspot.com/-DMQ5xuNDycY/Ss9FmzgKcnI/AAAAAAAAABU/IiYfzajKiNI/s1600/DSC03967.JPG, https://albatrosses.in/wp-content/uploads/2024/10/Explore-the-Sacred-Dichpally-Ramalayam-Temple.jpg"
Sri Chennakesava Swaami Temple,15.7094044,80.0558347,Daivalaravuru,Andhra Pradesh,India,"Chennakeshava Temple, also referred to as Keshava, Kesava or Vijayanarayana Temple of Belur, is a 12th-century Hindu temple in, Hassan district of Karnataka state, India.","https://en.wikipedia.org/wiki/Chennakeshava_Temple,_Belur",,,https://www.google.com/maps/search/?api=1&query=Sri%20Chennakesava%20Swaami%20Temple%20Daivalaravuru%20temple,"https://allworldtemple.com/wp-content/uploads/2023/04/Chennakeshava-Temple-Belur.jpg, http://images.deccanchronicle.com/9ac2110f4739dd335801778cca663344474b088c-tc-img-preview.jpg"
Hanuman Temple,15.710953,80.0544278,Daivalaravuru,Andhra Pradesh,India,"Dasa Hanuman Temple is a hindu temple located in Dilawarpur, Telangana. The average rating of this place is 3.60 out of 5 stars based on 7 reviews. The street address of this place is 36VH+8P2, Dilawarpur, Telangana 504306, India. It is about 8.31 kilometers away from the Chicholibuzu railway station.",https://yappe.in/telangana/dilawarpur/dasa-hanuman-temple/818067,,,https://www.google.com/maps/search/?api=1&query=Hanuman%20Temple%20Daivalaravuru%20temple,"http://1.bp.blogspot.com/-9lPMM8LczQM/TbAWrAsBL1I/AAAAAAAACOc/FgzbwAtpZZs/s1600/hanuman.jpg, https://c8.alamy.com/comp/BBB5G1/hanuman-hindu-temple-bangalore-karnataka-india-BBB5G1.jpg"
Sahashra Lingeswara Swamy Temple,13.6907154,79.7069958,Vedam,Andhra Pradesh,India,"Sahasra Lingeshwara Swami Temple is a hindu temple and tourist attraction located in Srikalahasti, Andhra Pradesh. The average rating of this place is 4.60 out of 5 stars based on 324 reviews. The street address of this place is MPR4+7RJ, Srikalahasti - Masalapadu Rd, Srikalahasti, Thottambedu, Andhra Pradesh 517644, India.",https://yappe.in/andhra-pradesh/srikalahasti/sahasra-lingeshwara-swami-temple/829653,,,https://www.google.com/maps/search/?api=1&query=Sahashra%20Lingeswara%20Swamy%20Temple%20Vedam%20temple,"https://holyshrines.in/wp-content/uploads/2020/10/Ponnuru-Sahasra-Lingeshwara-Swamy-Shiva-Temple11.jpg, https://www.visittemples.com/uploads/temple/image/sahas8_1725062400.jpg"
mallaiyakonda lord siva temple,13.8455555,78.4756102,Thamballapalle,Andhra Pradesh,India,"Sri Bhramarambikasametha Mallikarjuna Swamy Temple or Mallayyakonda Temple is a Hindu temple dedicated to the deities Lord Shiva and Parvati located at Mallayakonda Hills in the Chittoor District nearby Mandal headquarters of Thamballapalli. ... Mallayyakonda Temple, Thamballapalle Mandal, Chittoor District, Andhra Pradesh PIN - 517418 .",https://mallayyakonda.com/,,,https://www.google.com/maps/search/?api=1&query=mallaiyakonda%20lord%20siva%20temple%20Thamballapalle%20temple,"https://i.ytimg.com/vi/3sx-ISbXIY0/maxresdefault.jpg, https://i.ytimg.com/vi/J_Bdc1tvSOY/maxresdefault.jpg"
Saibaba Temple,16.0748257,78.9034601,Sundipenta,Andhra Pradesh,India,"Four main aartis are performed daily: Kakad Aarti (Morning): Held at 5:15 AM, this aarti marks the beginning of the day's rituals.SAI; Madhyan Aarti (Afternoon): Conducted at 12:00 PM, this midday aarti is a significant part of the temple's worship schedule. Dhoop Aarti (Evening): Performed at sunset, around 4:00 PM, this aarti signifies the transition from day to evening.",https://visitindia.co/shirdi-sai-baba-temple/,,,https://www.google.com/maps/search/?api=1&query=Saibaba%20Temple%20Sundipenta%20temple,"https://i.ytimg.com/vi/AjkfnlYCmV0/maxresdefault.jpg, http://www.saibabapuja.org/images/sirdi-sai-temple.jpg"
Poleramma Temple,16.0705454,78.9084828,Sundipenta,Andhra Pradesh,India,"The temple was first constructed by British village officer in India in the 1800s, [2] before which villagers worship Poleramma in form of a mud deity, created on special occasions but without permanent form or establishment. Since the permanent temple was established, Poleramma celebrations were performed with rituals in various Hindu festival celebrations.",https://en.wikipedia.org/wiki/Beeramgunta_Poleramma_Temple,,,https://www.google.com/maps/search/?api=1&query=Poleramma%20Temple%20Sundipenta%20temple,"https://sripolerammatemple.com/assets/images/poleramma-1.jpg, https://sripolerammatemple.com/assets/images/poleramma-6.jpg"
Akkamma Shiva Temple,16.0708202,78.9084879,Sundipenta,Andhra Pradesh,India,"akkamma shiva temple akkamma shiva temple is a Hindu temple in Srisailam, Nandyal district, Andhra Pradesh. akkamma shiva temple is situated close to the Hindu temple Poleramma Temple and the park environment education center.",https://mapcarta.com/N4577004158,,,https://www.google.com/maps/search/?api=1&query=Akkamma%20Shiva%20Temple%20Sundipenta%20temple,"https://lh3.googleusercontent.com/5FdwZcZCBmuQl6TJV_BMsqf3sdwnw6FC4AnWIwjYq62mDZLLUEFQEVizTQJJ8lEa=w1080-k-no, https://images1.wionews.com/images/wion/900x1600/2023/5/14/1684082226319_30.jpg"
Anjaneya swami Temple,18.095378,83.5211823,Rellivalasa,Andhra Pradesh,India,"Experience spirituality at Shree Anjaneya Swami Temple, Thiruvattar. Located in the serene Kanniyakumari District of Tamil Nadu, this sacred temple is a testament to India's rich history and miracles. Join us on a spiritual journey that inspires humanity. shreeanjaneya0@gmail.com +91 94442 76568.",https://www.shreeanjaneya.com/,shreeanjaneya0@gmail.com,+91 94442 76568,https://www.google.com/maps/search/?api=1&query=Anjaneya%20swami%20Temple%20Rellivalasa%20temple,"https://live.staticflickr.com/1512/24331262313_6e34875a60.jpg, http://photos.wikimapia.org/p/00/04/90/13/09_full.jpg"
Srirama temple,18.0913437,83.5241031,Malakam,Andhra Pradesh,India,"Serving the needs of the Hindu Community Temple Hours: Monday - Friday: 9:30am - 12:30pm | 5:30pm - 8:30pm. ... Bhadradri Sri Rama Temple of USA. On an auspicious day in the early January month of 2016, priest Archakam Padmanabha Acharyulu was blessed with a rare divine thought to build Bhadradri Sri Ramanarayana Swamy temple in USA . ...",https://www.bhadradrisriramatempleofusa.org/,,,https://www.google.com/maps/search/?api=1&query=Srirama%20temple%20Malakam%20temple,"https://static.toiimg.com/photo/msid-72007734,width-96,height-65.cms, http://photos.wikimapia.org/p/00/01/15/19/90_big.jpg"
Shivalayam,18.1148891,83.5152245,Kumili,Andhra Pradesh,India,"Sivalaya Ottam - Route map and Distance chart. Sivalaya Ottam (Tamil: சிவாலய ஓட்டம், Malayalam: ശിവാലയ ഓട്ടം) is a ritual marathon undertaken by the devotees to the 12 Siva shrines in the district of Kanyakumari on the day of Sivarathri. [1]From 2014 onwards the day was announced as a local holiday for the district.",https://en.wikipedia.org/wiki/Sivalaya_Ottam,,,https://www.google.com/maps/search/?api=1&query=Shivalayam%20Kumili%20temple,"https://i.ytimg.com/vi/rS7AIJ5nTXs/maxresdefault.jpg, https://i.ytimg.com/vi/HuOKqbqmQhA/maxresdefault.jpg"
SVB,13.2205655,78.9330552,Timmajipalle,Andhra Pradesh,India,"Visit Sringeri Sharada Peetham Site Sringeri Vidya Bharati Foundation, Canada Sri Guruvayurappan Temple, Krishnaji Mandir, New Jersey",https://www.svbf.org/,,,https://www.google.com/maps/search/?api=1&query=SVB%20Timmajipalle%20temple,"https://blogger.googleusercontent.com/img/b/R29vZ2xl/AVvXsEhu0ynoGCSDhVJflRY9PLDZW4qT4GVzK2H6WBSR1PFEj0HUEDkclgk3X6c2kWOB1qkZi_iQea-QSx3SggsUy3h5hrjMopzxiZCf6Svb3cHWQugB_2nGO1ezmlrHWeLq3sjVxCiKGbJCkjJdy6WoKqBFvG1O6XjmSx8mKHn7qwEokGg5zy5gA-7Lu7N5/s4000/20210806_185451.jpg, https://religionnews.com/wp-content/uploads/2023/11/dims.apnews-5-scaled.webp"
Gauramma thalli temple,13.2213395,78.9330431,Timmajipalle,Andhra Pradesh,India,"Gauramma thalli temple is a Hindu temple in Bangarupalem, Chittoor, Andhra Pradesh. Gauramma thalli temple is situated nearby to the Hindu temple SVB, as well as near the pond బొమ్మాయపల్లి చెరువు.",https://mapcarta.com/N4652768087,,,https://www.google.com/maps/search/?api=1&query=Gauramma%20thalli%20temple%20Timmajipalle%20temple,"https://hinduscriptures.com/wp-content/uploads/2020/01/GANGAMMA.jpg, https://www.shutterstock.com/image-photo/famous-historic-temple-gogulamma-thalli-600w-1494582914.jpg"
వజ్రాలపురం గంగమ్మ గుడి,13.2244888,78.9170747,Vankamitta,Andhra Pradesh,India,ఈ ప్రదేశానికి వజ్రాల గంగమ్మ అని పేరు. ఇక్కడ సరస్వతీ గుండం ...,https://www.youtube.com/watch?v=Sn5bYWETcsk,,,https://www.google.com/maps/search/?api=1&query=%E0%B0%B5%E0%B0%9C%E0%B1%8D%E0%B0%B0%E0%B0%BE%E0%B0%B2%E0%B0%AA%E0%B1%81%E0%B0%B0%E0%B0%82%20%E0%B0%97%E0%B0%82%E0%B0%97%E0%B0%AE%E0%B1%8D%E0%B0%AE%20%E0%B0%97%E0%B1%81%E0%B0%A1%E0%B0%BF%20Vankamitta%20temple,"https://i.ytimg.com/vi/ju-45XKxVAw/hq720_2.jpg?sqp=-oaymwEkCJYDENAFSFryq4qpAxYIARUAAAAAJQAAyEI9AICiQ3gB0AEB&rs=AOn4CLAOPkRMPdGwRHaVZNFj7ShrEz8eMA, https://media.andhrajyothy.com/media/2022/20221123/gangamma_templ_6ca322b607.jpg"
Sai Baba Temple,14.699292,76.8552863,Rayadurgam,Andhra Pradesh,India,"For Real Time Official Live Darshan of Shree Sai Baba Samadhi Mandir, Shirdi Click here. About Shree Saibaba Sansthan Trust, Shirdi, is the Governing and Administrative body of Shri Saibaba's Samadhi Temple and all others temples in this premises, and devoted towards teachings of Saibaba "" Sabka Malik Ek "" and providing amenities to Sai ...",https://sai.org.in/,,,https://www.google.com/maps/search/?api=1&query=Sai%20Baba%20Temple%20Rayadurgam%20temple,"https://a.travel-assets.com/findyours-php/viewfinder/images/res40/206000/206692-Shirdi.jpg, http://www.saibabapuja.org/images/sirdi-sai-temple.jpg"
BAM  BAM  Swamy  temple,14.6999049,76.8640324,Rayadurgam,Andhra Pradesh,India,Bam Bam swamy seva samiti yarapalyachowdappa yl yutube channel please 🙏 subscribe,https://www.youtube.com/watch?v=NQjVuUx5OyE,,,https://www.google.com/maps/search/?api=1&query=BAM%20%20BAM%20%20Swamy%20%20temple%20Rayadurgam%20temple,"https://4.bp.blogspot.com/-6TYQLMIpPKQ/Vn05QKcfwhI/AAAAAAAACLY/DPaxK3E74_8/s1600/excellent-arc-at-rayadurgam.jpg, https://3.bp.blogspot.com/-8aMbXfkXQfA/Vn05P61wmfI/AAAAAAAACLk/6cijGnuu2Eo/s1600/rayadurgam-temple-at-anantapur-dist.jpg"
Durgamatha Temple,14.6939422,76.8522878,Rayadurgam,Andhra Pradesh,India,"Temple Address: Sri Prasanna Venkateswara Swamy Temple, Rayadurgam, Anantapur District, Andhra Pradesh. Credits: Sri Thirumal Prasad Patil Related Postings : > Nemakallu Sri Anjaneyaswamy Temple > Sri Muradi Anjaneya Swamy Temple > Kadhri Lakhsmi Narasimha Temple Accommodation Details > List Of Anantapuram District Hindu Temples Rayadurgam venkateswara swamy temple information in telugu ...",https://www.hindutemplesguide.com/2015/12/rayadurgam-sri-prasanna-venkataramana.html,,,https://www.google.com/maps/search/?api=1&query=Durgamatha%20Temple%20Rayadurgam%20temple,"https://blogs.revv.co.in/blogs/wp-content/uploads/2020/11/Amba-Mata-Temple-Gujarat.jpg, https://gumlet.assettype.com/freepressjournal/import/2018/10/durga-temple.jpg?w=1200"
Krishna temple,14.7054655,76.8563425,Rayadurgam,Andhra Pradesh,India,"Veerabhadraswamy Temple is a hindu temple located in Rayadurgam, Andhra Pradesh. The average rating of this place is 4.40 out of 5 stars based on 7 reviews. The street address of this place is MRXW+CJ3, Rayadurg, Rayadurgam, Andhra Pradesh 515865, India. It is about 0.56 kilometers away from the Raya Drug railway station.",https://yappe.in/andhra-pradesh/rayadurgam/veerabhadraswamy-temple/1958160,,,https://www.google.com/maps/search/?api=1&query=Krishna%20temple%20Rayadurgam%20temple,"https://www.holidify.com/images/cmsuploads/compressed/temple-4939831_1920_20200417163506.jpg, https://3.bp.blogspot.com/-8aMbXfkXQfA/Vn05P61wmfI/AAAAAAAACLk/6cijGnuu2Eo/s1600/rayadurgam-temple-at-anantapur-dist.jpg"
Talupulamma Thalli temple,17.3785073,82.5320945,Kollmeru,Andhra Pradesh,India,"Talupulamma Temple (popularly known as Talupulamma Lova) is a Hindu pilgrimage site located in the village of Lova in Kakinada district of Andhra Pradesh, India. [1] [2] The presiding deity is a gramadevatha known as Talupulamma Thalli (lit.Goddess who grants wishes). [2]It is located between two heavily forested hillocks Darakonda and Teegakonda near the City of Tuni and has views of the valley.","https://en.wikipedia.org/wiki/Talupulamma_Temple,_Lova",,,https://www.google.com/maps/search/?api=1&query=Talupulamma%20Thalli%20temple%20Kollmeru%20temple,"https://images.tv9telugu.com/wp-content/uploads/2023/05/talupulamma-lova-temple-7.jpg, https://blogger.googleusercontent.com/img/b/R29vZ2xl/AVvXsEgoFwGdmQks240WpxcsTQ2CSqO-LuPGfjWO3fkppQ2yJKHnQqMY6aoaeb3Ynac2dCrawrsevloccF7LhNHCDfOkOIR3Id5slXLf6hV-MM0dDccEn518aYG_dktN9XQLqrIVjU4xD1uL8vY/w1200-h630-p-k-no-nu/lova+hindu+temples+guide.jpg"
sri venkateswara temple,14.6982829,76.8434853,Rayadurgam,Andhra Pradesh,India,"Temple Address: Sri Prasanna Venkateswara Swamy Temple, Rayadurgam, Anantapur District, Andhra Pradesh. Credits: Sri Thirumal Prasad Patil Related Postings : > Nemakallu Sri Anjaneyaswamy Temple > Sri Muradi Anjaneya Swamy Temple > Kadhri Lakhsmi Narasimha Temple Accommodation Details > List Of Anantapuram District Hindu Temples Rayadurgam venkateswara swamy temple information in telugu ...",https://www.hindutemplesguide.com/2015/12/rayadurgam-sri-prasanna-venkataramana.html,,,https://www.google.com/maps/search/?api=1&query=sri%20venkateswara%20temple%20Rayadurgam%20temple,"https://lh5.googleusercontent.com/p/AF1QipPlhMM5IzD6gAT6Q_nJIlwkI5s9hZyuZsVpkZ00=w1080-k-no, https://1.bp.blogspot.com/-dAEml_mwQVo/Vn06jkBJOBI/AAAAAAAACL8/xZfbPdC5qKY/s1600/original-rayaduram-venkateswara-image.jpg"
Hanuman Temple,14.4213769,79.977782,Nellore,Andhra Pradesh,India,"Sri Hanuman Mandiram is a hindu temple located in Nellore, Andhra Pradesh. The average rating of this place is 4.60 out of 5 stars based on 56 reviews. The street address of this place is No-30/1108, near old gowda hostel, Balaji Nagar, Nellore, Andhra Pradesh 524002, India. It is about 0.68 kilometers away from the Nellore railway station.",https://yappe.in/andhra-pradesh/nellore/hanuman-temple/130067,,,https://www.google.com/maps/search/?api=1&query=Hanuman%20Temple%20Nellore%20temple,"https://i.ytimg.com/vi/xkymgTbfZdQ/maxresdefault.jpg, https://i.pinimg.com/originals/5d/80/c8/5d80c80a9e4b919086573cd03f3ec1bc.jpg"
Lord shiva temple,16.4259869,80.6251507,Mellempudi,Andhra Pradesh,India,"Shivaalayam is a hindu temple located in Mellempudi, Andhra Pradesh. The average rating of this place is 4.70 out of 5 stars based on 29 reviews. The street address of this place is CJGG+C26, Mellempudi, Andhra Pradesh 522303, India. It is about 1.13 kilometers away from the Peddavadlapu railway station.",https://yappe.in/andhra-pradesh/mellempudi/shivaalayam/1982853,,,https://www.google.com/maps/search/?api=1&query=Lord%20shiva%20temple%20Mellempudi%20temple,"https://static.toiimg.com/photo/65166202/shiva.jpg?width=748&resize=4, https://thumbs.dreamstime.com/z/lord-shiva-bhagwan-temple-hindu-mandir-169456747.jpg"
Vinayaka temple,16.4254039,80.6267657,Mellempudi,Andhra Pradesh,India,"Shivaalayam is a hindu temple located in Mellempudi, Andhra Pradesh. The average rating of this place is 4.70 out of 5 stars based on 29 reviews. The street address of this place is CJGG+C26, Mellempudi, Andhra Pradesh 522303, India. It is about 1.13 kilometers away from the Peddavadlapu railway station.",https://yappe.in/andhra-pradesh/mellempudi/shivaalayam/1982853,,,https://www.google.com/maps/search/?api=1&query=Vinayaka%20temple%20Mellempudi%20temple,"https://www.revv.co.in/blogs/wp-content/uploads/2020/05/Siddhivinayak-Temple-1024x978.jpg, https://im.whatshot.in/img/2020/Aug/panchamukhi-fb-cropped-1-1598260158.jpg"
Madhavaswamy Temple,17.10952,82.2503297,Pithapuram,Andhra Pradesh,India,"Kunthi Madhava Swamy Temple Pithapuram is dedicated to Lord Vishnu. It is one of the five temples which were established by the Indra, God of Heaven. Kunthi Madhava Swamy Temple Pithapuram History. As per the Legends, Chitraketu was an ardent devotee of Lord Vishnu was taught with Spiritual truths by the serpent king Adi Sesha during his tough ...",https://gotirupati.com/kunthi-madhava-swamy-temple-pithapuram/,,,https://www.google.com/maps/search/?api=1&query=Madhavaswamy%20Temple%20Pithapuram%20temple,"https://holyshrines.in/wp-content/uploads/2020/10/DSC00305.jpg, https://www.lifeofaash.com/wp-content/uploads/2023/10/WhatsApp-Image-2023-10-08-at-9.40.21-PM-1024x576.jpeg"
Sai Baba Temple,18.6833432,83.947254,Hiramandalam,Andhra Pradesh,India,"For Real Time Official Live Darshan of Shree Sai Baba Samadhi Mandir, Shirdi Click here. About Shree Saibaba Sansthan Trust, Shirdi, is the Governing and Administrative body of Shri Saibaba's Samadhi Temple and all others temples in this premises, and devoted towards teachings of Saibaba "" Sabka Malik Ek "" and providing amenities to Sai ...",https://sai.org.in/,,,https://www.google.com/maps/search/?api=1&query=Sai%20Baba%20Temple%20Hiramandalam%20temple,"http://www.saibabapuja.org/images/sai-baba-temple-chennai.jpg, http://www.saibabapuja.org/images/sai-temple-ap.jpg"
Ramalayam,18.6833482,83.9467282,Hiramandalam,Andhra Pradesh,India,"Dichpally Ramalayam is a Lord Rama temple located in Dichpally Village of Nizamabad, ... This is also called Khilla Ramalayam [1] Architecture. Temple was built of black and white basalt stone, with the finest architecture and excellent craftsmanship of goddesses, animals, devils and Khajuraho style erotic structures on it. This ancient temple ...",https://en.wikipedia.org/wiki/Dichpally_Ramalayam,,,https://www.google.com/maps/search/?api=1&query=Ramalayam%20Hiramandalam%20temple,"https://albatrosses.in/wp-content/uploads/2024/10/Explore-the-Sacred-Dichpally-Ramalayam-Temple.jpg, https://2.bp.blogspot.com/-DMQ5xuNDycY/Ss9FmzgKcnI/AAAAAAAAABU/IiYfzajKiNI/s1600/DSC03967.JPG"
Vinayaka Temple,14.8986048,79.9921784,Kavali,Andhra Pradesh,India,"The Prime deity of this Temple is Sri Varasiddhi Vinayaka Swamy is a swayambhu, self-manifested idol. A very interesting fact is associated with this temple is that Sri Vinayaka Idol size is increasing day by day. It is believed that the idol will be growing in size until the end of Kaliyuga and then Sri Vinayaka will appear in person.",https://srikanipakadevasthanam.org/en-in/home,,,https://www.google.com/maps/search/?api=1&query=Vinayaka%20Temple%20Kavali%20temple,"http://templesinindiainfo.com/wp-content/uploads/2021/09/Kalugolamma-Temple-Kavali.jpg, https://www.bhaktibharat.com/photo/mandir/vinayaka-temple-59-noida/dp.jpg?tr=w-425"
Sri Venkateswara Swami Temple,14.8985166,79.9949239,Kavali,Andhra Pradesh,India,"The Venkateswara Temple of Tirumala or Sri Venkateswara Swami Temple is a Hindu temple situated in the hills of Tirumala, Tirupati Urban Mandal in the Tirupati district of Andhra Pradesh, India. The temple is dedicated to Venkateswara , a form of Vishnu , who is believed to have appeared on earth to save mankind from trials and troubles of Kali ...","https://en.wikipedia.org/wiki/Venkateswara_Temple,_Tirumala",,,https://www.google.com/maps/search/?api=1&query=Sri%20Venkateswara%20Swami%20Temple%20Kavali%20temple,"https://blogger.googleusercontent.com/img/b/R29vZ2xl/AVvXsEipltJ0wczwbIcZiZHcwIYBgiW0sxjfHAnxZktbeGoGwx_iMV2zHfPwI2rhHv5gCjv3O-vDlVanWJaj03O3puRkw4F27zDEX-xYVpH1w0cAOxlHNCsyb41__vssoHDwa-V25OjoBUMgX02iXZrkSUXMr-1R2HN9gztUlEL05TPDXFVRG6OtN6XieVUMFjo/s960/venkateswara+temple+kavali.jpg, https://lh5.googleusercontent.com/p/AF1QipO5aMIIYifNUeNYa0qlIUa2QC1Ms-xuae3M8bow=w1080-k-no"
sivalayam,16.8115695,81.2662704,Polasanipalli,Andhra Pradesh,India,"I stepped out from the crowded car into a haphazard, narrow, dusty street. The sun beat down on the single-floor cement homes that lined the alley-like road, and the local villagers of Peddapalli closed around me in the afternoon bustle. Bits of Urdu and Telugu floated around my ears as I walked with my mother… Read More »Visiting my hometown's Shivalaya temple - Hindu history is ...",https://www.hindustudentscouncil.org/2020/visiting-my-hometowns-shivalaya-temple-hindu-history-is-integral-to-personal-identity/,,,https://www.google.com/maps/search/?api=1&query=sivalayam%20Polasanipalli%20temple,"http://photos.wikimapia.org/p/00/02/76/12/17_full.jpg, http://photos.wikimapia.org/p/00/02/76/12/19_full.jpg"
Sai Baba Temple,16.8188345,81.2578107,Bhimadole,Andhra Pradesh,India,"For Real Time Official Live Darshan of Shree Sai Baba Samadhi Mandir, Shirdi Click here. About Shree Saibaba Sansthan Trust, Shirdi, is the Governing and Administrative body of Shri Saibaba's Samadhi Temple and all others temples in this premises, and devoted towards teachings of Saibaba "" Sabka Malik Ek "" and providing amenities to Sai ...",https://sai.org.in/,,,https://www.google.com/maps/search/?api=1&query=Sai%20Baba%20Temple%20Bhimadole%20temple,"http://www.saibabapuja.org/images/sai-baba-temple-chennai.jpg, http://www.saibabapuja.org/images/sai-temple-ap.jpg"
Sri Rama Mandiram,16.8126028,81.261564,Bhimadole,Andhra Pradesh,India,Bhimadole; Andhra Pradesh 534425; India phone: 0.5 KM distance Details Sri Kanakadurga Devalayam Bhimadole; Andhra Pradesh 534425; India phone: 0.6 KM distance Details Sri Rama Mandiram Bhimadole Village Bypass Rd; Bhimadole; Andhra Pradesh 534425; India phone: 0.6 KM distance Details Ayyapa swamy temple,https://www.onefivenine.com/india/Listing/Town/temples/West-Godavari/Bhimadole,,,https://www.google.com/maps/search/?api=1&query=Sri%20Rama%20Mandiram%20Bhimadole%20temple,"https://cdn.sharechat.com/27b8aa4e_1596552313851.jpeg, https://www.hindustudentscouncil.org/wp-content/uploads/2020/08/ram-1-1.jpg"
Vinayaka Temple,18.6751478,83.9489828,Hiramandalam,Andhra Pradesh,India,"The temple deity is called Kodandarama, or Rama holding his bow, named ""kodanda."" The main deity is also in marriage arrangement or Kalyana-rama, as Sita is to Rama's right, as opposed to the more common arrangement where she appears to his left. The temple is likely the oldest surviving, and continuously operating temple dedicated to Rama.","https://en.wikipedia.org/wiki/Kodandarama_Temple,_Hiremagalur",,,https://www.google.com/maps/search/?api=1&query=Vinayaka%20Temple%20Hiramandalam%20temple,"https://www.revv.co.in/blogs/wp-content/uploads/2020/05/Siddhivinayak-Temple-1024x978.jpg, https://im.whatshot.in/img/2020/Aug/panchamukhi-fb-cropped-1-1598260158.jpg"
