Temple Name,latitude,longitude,City,state,Country,Description,Website,Email,Phone,Google Maps Link,Image URLs
Sri Rama Temple,17.0657439,80.3917142,Konijerla,Andhra Pradesh,India,Vontimitta Sri Kodandarama Swamy temple is a famous Hindu temple in Andhra Pradesh state is dedicated to Lord Rama. The temple is present in Vontimitta town of Rajampet taluk in YSR Kadapa District. History Sri Kondandarama Swamy sanctuary has a place with the Vijayanagara rulers amid the sixteenth century.,http://www.hindutourism.com/1-219-1/sri-kodanda-rama-swamy-temple-vontimitta,,,https://www.google.com/maps/search/?api=1&query=Sri%20Rama%20Temple%20Konijerla%20temple,"https://static.toiimg.com/photo/msid-72007734,width-96,height-65.cms, https://imvoyager.com/wp-content/uploads/2022/12/Ram-Janmabhoomi-Temple-in-Ayodhya-.jpeg"
Venu Gopala Swami Temple,17.0669093,80.3959331,Nemali,Andhra Pradesh,India,Visited venugopala Swami temple 2days ago on Ugadi.they're trying to close at12: 30 pm afternoon.they sending out all the devotees and making nonsense. Just for enterence temple tickets are ₹10& ₹50. Advantages of temple is village's around.trust build on lord Krishna.,https://bharatbz.com/andhra/venu-gopala-swami-temple-146253,,,https://www.google.com/maps/search/?api=1&query=Venu%20Gopala%20Swami%20Temple%20Nemali%20temple,"http://photos.wikimapia.org/p/00/01/59/17/99_big.jpg, http://indiainoneplace.com/wp-content/uploads/2018/10/Venugopala-Swamy-Temple-Bobbili5-Copy-1.jpg"
"Sri Ramalayam,Gollapudi",16.5411444,80.578304,Gollapudi,Andhra Pradesh,India,"Sri Ramalayam,Gollapudi Sri Ramalayam,Gollapudi is a Hindu temple in Vijayawada Rural, NTR, Andhra Pradesh. Sri Ramalayam,Gollapudi is situated close to the Hindu temple Shivalayam,Gollapudi and the government office Gollapudi grama Panchayathi Office.",https://mapcarta.com/N5315832352,,,https://www.google.com/maps/search/?api=1&query=Sri%20Ramalayam%2CGollapudi%20Gollapudi%20temple,"https://dynamic.tourtravelworld.com/hotspot-images/ayyappa-swami-temple-gollapudi-6383.jpg, https://1.bp.blogspot.com/-dbbM9A7E3IQ/XcjiFsbsgkI/AAAAAAAAAw4/XAhv6VKg3RQzWK7htznZC3UZvCEldE9IgCLcBGAsYHQ/s640/Vontimitta+Temple.jpg"
"Shivalayam,Gollapudi",16.540969,80.5782268,Gollapudi,Andhra Pradesh,India,"Shivalayam,Gollapudi is a Hindu temple in Kistna District, Andhra Pradesh. Shivalayam,Gollapudi is situated nearby to the Hindu temple Sri Ramalayam,Gollapudi and the government office Gollapudi grama Panchayathi Office .",https://mapcarta.com/N5315832353,,,https://www.google.com/maps/search/?api=1&query=Shivalayam%2CGollapudi%20Gollapudi%20temple,"https://i.ytimg.com/vi/rS7AIJ5nTXs/maxresdefault.jpg, https://live.staticflickr.com/1051/1443215655_c9eb7837c4_b.jpg"
"Sai Baba temple,Gollapudi",16.5486001,80.5820404,Gollapudi,Andhra Pradesh,India,"Visit Sankalpa Siddi Sri Shirdi Sai Baba Temple, a beautiful temple known for its spiritual significance and serene surroundings.... Get temple timings, history, facilities & more information at TempleWiki. ... Old H.B. Colony, Near Gandhi Complex, Bhavanipuram, Gollapudi, Vijayawada; Timings: 6:00 AM - 8:00 PM; Rating: 4.8 /5. The temple is ...",https://www.templewiki.com/sankalpa-siddi-sri-shirdi-sai-baba-temple,,,https://www.google.com/maps/search/?api=1&query=Sai%20Baba%20temple%2CGollapudi%20Gollapudi%20temple,"https://english.cdn.zeenews.com/sites/default/files/2021/02/24/919204-shirdi-temple.jpg, https://pujanpujari.com/wp-content/uploads/2022/07/Shirdi-Sai-Baba-Temple.jpg"
Sri Rama Swamy Temple,16.3972328,80.6250755,Morampudi,Andhra Pradesh,India,"Sri Rama Chandra Swamy Temple, also known as Ammapalli Temple or Sri Rama Temple, is a historic and iconic Hindu temple located in Ammapalli village in the Shamshabad region of Hyderabad, Telangana, India. The temple is dedicated to Lord Rama, one of the major deities of Hinduism, and is known for its cultural and historical significance ...",https://yometro.com/travel-guide/attraction-sri-rama-chandra-swamy-temple-hyderabad,,,https://www.google.com/maps/search/?api=1&query=Sri%20Rama%20Swamy%20Temple%20Morampudi%20temple,"https://sribalajigrandkumbakonam.com/wp-content/uploads/2022/06/Ramaswamy.png, https://www.templetimings.com/wp-content/uploads/2018/08/sri-ramaswamy-temple_1418809796-768x576.png"
Rambha malleswara swamy temple,16.3986979,80.6251178,Morampudi,Andhra Pradesh,India,"Mahakali temple, morampudi Mahakali temple, Mahakali temple Guntur district, katamaraju konduru mahankali temple, Kalika temple, Mahakali temple AP, Dileep A...",https://www.youtube.com/watch?v=2fPkzrWpdyM,,,https://www.google.com/maps/search/?api=1&query=Rambha%20malleswara%20swamy%20temple%20Morampudi%20temple,"https://blogger.googleusercontent.com/img/b/R29vZ2xl/AVvXsEhxUvPWNAB2ylRYAfubRez2rUikRrD8a3hA7bhaNCeQ2hNEEYvE3JLbvhIDTs40vYVpNkfIuNwa-MtW8JLMa8f4dHbXvt_PtE3yLoGCqI7DzKIxFYiDc29QVIzzk-d0do5F1SxpJSf10Gzg/s1600/Sri+Malleswara+Swamy+Vari+Devasthanam.JPG, https://i.pinimg.com/originals/bc/6e/9e/bc6e9eff8442314324f43548d9748504.jpg"
Sri Venkateshwara Swamy Temple,16.3264622,80.4149986,Guntur,Andhra Pradesh,India,"Sri Venkateswara Swamy Temple is a hindu temple located in Guntur, Andhra Pradesh. The average rating of this place is 4.60 out of 5 stars based on 111 reviews. The street address of this place is 8C5C+7RH, Krishna Nagar, Guntur, Andhra Pradesh 522006, India. It is about 0.96 kilometers away from the Guntur Junction railway station.",https://yappe.in/andhra-pradesh/guntur/sri-venkateswara-swamy-temple/1359800,,,https://www.google.com/maps/search/?api=1&query=Sri%20Venkateshwara%20Swamy%20Temple%20Guntur%20temple,"https://files.yappe.in/place/small/sri-venkateswara-swamy-temple-9453502.webp, https://files.yappe.in/place/small/sri-venkateswara-swamy-temple-9453501.webp"
Anjaneya swami temple,16.3380998,79.949016,Vipparla,Andhra Pradesh,India,"Anjaneya Swamy Temple is a hindu temple located in Visakhapatnam, Andhra Pradesh. The average rating of this place is 4.90 out of 5 stars based on 22 reviews. The street address of this place is 27/4/19 near poorna market, Town Kotha Rd, Jagadamba Junction, Visakhapatnam, Andhra Pradesh 530001, India.",https://yappe.in/andhra-pradesh/visakhapatnam/anjaneya-swamy-temple/387512,,,https://www.google.com/maps/search/?api=1&query=Anjaneya%20swami%20temple%20Vipparla%20temple,"https://live.staticflickr.com/1512/24331262313_6e34875a60.jpg, http://photos.wikimapia.org/p/00/04/90/13/09_full.jpg"
Anjaneya Swami temple,16.4775097,79.8991478,Piduguralla,Andhra Pradesh,India,"Sri Anjaneya Swamy Temple is located in Piduguralla, District of Guntur State of Andhrapradesh. ... 45 feet han... Sri Anjaneya Swamy Temple is located in Piduguralla, District of Guntur State of Andhrapradesh. ... Hindu Temples Guide Website Gives You Tirumala Latest Updates and Arjitha Seva details Tirumala 300 Rupess Tickets Anga Pradakshina ...",https://www.hindutemplesguide.com/2016/01/piduguralla-hanuman-temple.html,,,https://www.google.com/maps/search/?api=1&query=Anjaneya%20Swami%20temple%20Piduguralla%20temple,"https://i.pinimg.com/originals/39/52/52/395252e3d792325ca4934e5ffd340d14.jpg, http://photos.wikimapia.org/p/00/04/90/13/08_full.jpg"
Sri anjaneya swami temple,16.4609557,79.9186215,KONDAMODU,Andhra Pradesh,India,"© 2005 - 2024 Kondagattu.org.All Rights Reserved. Web Site Designed, Developed & Maintained by Ramesh Nandi Email: srirajanna@yahoo.co.in",http://kondagattutemple.org/,srirajanna@yahoo.co.in,2005 - 2024,https://www.google.com/maps/search/?api=1&query=Sri%20anjaneya%20swami%20temple%20KONDAMODU%20temple,"https://files.yappe.in/place/small/sri-anjaneya-swami-temple-7266621.webp, https://files.yappe.in/place/small/sri-anjaneya-swami-temple-7266625.webp"
Sai baba temple,16.4770744,79.884334,Janapadu,Andhra Pradesh,India,"Shirdi Sai Baba Temple is a Hindu temple located in the neighbourhood of Mylapore in Chennai, India. It is dedicated to the Indian saint Sai Baba of Shirdi. The temple was built in 1952 by one Narasimhaswami, a Salem and Sai Baba devotee, out of money donated by a Chettiar merchant. This is considered the most trusted temple in India.",https://www.rvatemples.com/listings/mylapore-shirdi-sai-baba-temple/,,,https://www.google.com/maps/search/?api=1&query=Sai%20baba%20temple%20Janapadu%20temple,"https://a.travel-assets.com/findyours-php/viewfinder/images/res40/206000/206692-Shirdi.jpg, http://www.saibabapuja.org/images/sirdi-sai-temple.jpg"
Sai baba temple,16.4800872,79.8858782,Janapadu,Andhra Pradesh,India,"Shirdi Sai Baba Temple is a Hindu temple located in the neighbourhood of Mylapore in Chennai, India. It is dedicated to the Indian saint Sai Baba of Shirdi. The temple was built in 1952 by one B V Narasimhaswami from Salem, a Sai Baba devotee, out of money donated by a Chettiar merchant. This is considered the most trusted temple in India.","https://en.wikipedia.org/wiki/Shirdi_Sai_Baba_Temple,_Mylapore",,,https://www.google.com/maps/search/?api=1&query=Sai%20baba%20temple%20Janapadu%20temple,"https://a.travel-assets.com/findyours-php/viewfinder/images/res40/206000/206692-Shirdi.jpg, http://www.saibabapuja.org/images/sirdi-sai-temple.jpg"
sri veerabhadra swami temple,15.6409939,79.3151336,Obaya Palle,Andhra Pradesh,India,"Veerabhadra Temple is located on Devakuta Parvatham, a hillock on an islet amidst the Godavari River near Pattiseema in West Godavari, Andhra Pradesh.The temple is dedicated to Shiva and the namesake is Veerabhadra. [1] [2] [3]The temple is one of the 'pancha Kasi kshetras' (five important peaceful places) mentioned in the Skaanda puranam, a collection of Hindu religious texts.","https://en.wikipedia.org/wiki/Veerabhadra_Temple,_Pattiseema",,,https://www.google.com/maps/search/?api=1&query=sri%20veerabhadra%20swami%20temple%20Obaya%20Palle%20temple,"https://lh5.googleusercontent.com/p/AF1QipN8qzwt2r4OePilVhRyy7gg-GYQ_2MGKlPrTXJu=w1080-k-no, https://holyshrines.in/wp-content/uploads/2020/10/kothakonda-temple-in-karimnagar.jpg"
Venkataswami temple,16.2230329,80.0527828,Narasaraopet,Andhra Pradesh,India,"SRI VENKATESWARA SWAMY TEMPLE is a hindu temple located in Narasaraopeta, Andhra Pradesh. The average rating of this place is 4.70 out of 5 stars based on 36 reviews. The street address of this place is 62JW+65M, Prakash Nagar, Narasaraopeta, Andhra Pradesh 522601, India. It is about 0.37 kilometers away from the Narasaraopet railway station.",https://yappe.in/andhra-pradesh/narasaraopeta/sri-venkateswara-swamy-temple/881463,,,https://www.google.com/maps/search/?api=1&query=Venkataswami%20temple%20Narasaraopet%20temple,"https://c8.alamy.com/comp/C3KX9P/lord-venkateswara-temple-C3KX9P.jpg, https://files.yappe.in/place/small/kalyana-venkateswara-swamy-temple-6478487.webp"
Sri Veera Brahmendra Swami Vaari Temple,16.4822276,79.8827497,Piduguralla,Andhra Pradesh,India,"Sri Veera Brahmendra Swami Vaari Temple is a Hindu temple in Piduguralla, Palnadu district, Andhra Pradesh. Sri Veera Brahmendra Swami Vaari Temple is situated close to Piduguralla library and the place of worship Church .",https://mapcarta.com/N5445842122,,,https://www.google.com/maps/search/?api=1&query=Sri%20Veera%20Brahmendra%20Swami%20Vaari%20Temple%20Piduguralla%20temple,"https://i.pinimg.com/originals/e6/9c/76/e69c7677d2ad37b83c797ae80cfa7eb9.jpg, http://3.bp.blogspot.com/-7wNk8HFc1mg/ThhgarDQw6I/AAAAAAAAAzE/6ibufPOeLtA/w1200-h630-p-k-no-nu/Veerabrahmendra_swamy_temple.jpg"
Hanuman temple,16.2170211,80.0451317,Narasaraopet,Andhra Pradesh,India,"About Temple. This ancient temple of Lord Hanuman was built in 15th century during Vijaya Raghava Rayalu's dynasty, and later as most of the temples in India, this was also faced the wrath of the Muslim invaders. ... The strong belief existing in Hindu hearts that God gets his wishes fulfilled through human beings; was proved once again and ...",http://www.sreeprasannanjaneyaswamy.org/about-temple.html,,,https://www.google.com/maps/search/?api=1&query=Hanuman%20temple%20Narasaraopet%20temple,"http://1.bp.blogspot.com/-9lPMM8LczQM/TbAWrAsBL1I/AAAAAAAACOc/FgzbwAtpZZs/s1600/hanuman.jpg, https://c8.alamy.com/comp/BBB5G1/hanuman-hindu-temple-bangalore-karnataka-india-BBB5G1.jpg"
Sriranganadhaswamy Narayaneswara Temple,17.8672491,83.3218538,Mindipalem,Andhra Pradesh,India,"The Ranganathaswamy Temple is a Hindu temple dedicated to Ranganatha (a form of Vishnu) and his consort Ranganayaki (a form of Lakshmi).The temple is located in Srirangam, Tiruchirapalli, Tamil Nadu, India. [4] Constructed in the Tamil Architectural style, the temple is glorified by the Tamil poet-saints called the Alvars in their canon, the Naalayira Divya Prabhandam, [5] and has the unique ...","https://en.wikipedia.org/wiki/Ranganathaswamy_Temple,_Srirangam",,,https://www.google.com/maps/search/?api=1&query=Sriranganadhaswamy%20Narayaneswara%20Temple%20Mindipalem%20temple,"http://www.hindufaqs.com/wp-content/uploads/2015/04/Sri-Ranganathaswamy-Temple-4-10342.jpg, https://i.pinimg.com/originals/0a/52/38/0a5238ef3299257f0013e49bd34e6666.jpg"
Srivari Padalu,13.6791391,79.3332168,Tirumala,Andhra Pradesh,India,Sri Vari Padalu timings are from 6:00 AM - 6:00 PM. How To Reach Srivari Padalu. Padala mandapam is at a distance of 6 KMs from Tirumala Balaji Temple. It is located to the north of Balaji Temple. APSRTC operates buses from CRO Office to padalu mandapam. Taxis will also be operating between Padalu and Tirumala Bus Stand.,https://tirupatitirumalainfo.com/srivari-padalu-tirumala/,,,https://www.google.com/maps/search/?api=1&query=Srivari%20Padalu%20Tirumala%20temple,"https://blogger.googleusercontent.com/img/b/R29vZ2xl/AVvXsEgpRxu4qS1NL7Ug3qHVxzqHaVRWyXEiHYr6r5r7GE57sd7bbc2izjPI78WZ6E7cEAVQ7FEBs2Sjz8kGFWp8X9uC7UYdeVw8bJ7k5JF7Oo74NKkHQHF7x02cHoMBOWFAOHwuWu6Wqj2i7OE/s892/Sri-Vari-Padalu.jpg, https://news.tirumala.org/wp-content/uploads/2013/10/Picture-053.jpg"
Sri venugopala swami temple,16.0039383,80.6998526,Nagaram,Andhra Pradesh,India,"Sri Venugopalaswamy Temple is a Hindu-Vaishnavite temple situated at Karvetinagaram in, Chittoor District of Andhra Pradesh state, India. [1] ... Sarangapani, an early 18th century Telugu poet, had written many songs in praise of Venugopala swamy of this Temple, in Padam tradition. About 200 of his songs are in survive today in print form. [4 ...","https://en.wikipedia.org/wiki/Venugopalaswamy_Temple,_Karvetinagaram",,,https://www.google.com/maps/search/?api=1&query=Sri%20venugopala%20swami%20temple%20Nagaram%20temple,"http://www.touritvirtually.com/wp-content/uploads/2020/02/Kaarvetinagaram.jpg, https://3.bp.blogspot.com/-xd_xuISITUA/XDBkAhYld-I/AAAAAAABP8U/3OLDdpDrNuceCHEfIK5tzezFH_dNc8TTACLcBGAs/s1600/IMAG0520_1.jpg"
Ganapathi Temple,16.8619706,81.5160743,Chinna Tadepalle,Andhra Pradesh,India,About the Temple *. Your Experience *. Significance *,https://www.ishtadevata.com/temple/ganapathi-temple-chinnakondepudi-east-godavari-andhra-pradesh/,,,https://www.google.com/maps/search/?api=1&query=Ganapathi%20Temple%20Chinna%20Tadepalle%20temple,"https://im.whatshot.in/img/2020/Aug/panchamukhi-fb-cropped-1-1598260158.jpg, https://static.india.com/wp-content/uploads/2023/09/Collage-Maker-13-Sep-2023-02-34-PM-8170.jpg"
Ramalayam,16.8623034,81.5158795,Chinna Tadepalle,Andhra Pradesh,India,"Dichpally Ramalayam is a Lord Rama temple located in Dichpally Village of Nizamabad, Telangana built in 14th century by Kakatiya kings. As the temple has a lot of resemblance in its style and structure, it is also called the Indhoor Khajuraho or the Khajuraho of Nizamabad.",https://en.wikipedia.org/wiki/Dichpally_Ramalayam,,,https://www.google.com/maps/search/?api=1&query=Ramalayam%20Chinna%20Tadepalle%20temple,"https://2.bp.blogspot.com/-DMQ5xuNDycY/Ss9FmzgKcnI/AAAAAAAAABU/IiYfzajKiNI/s1600/DSC03967.JPG, https://files.yappe.in/place/small/ramalayam-temple-11225322.webp"
acchamaba temple,16.4185017,80.2183315,Ramakrishnapuram,Andhra Pradesh,India,"On weekends, national holidays, and select Hindu holidays, visitors are required to register for a reservation time slot and will be allowed entry no earlier than 30 minutes before and no later than 30 minutes after your time slot. A visit generally takes approximately 2-2.5 hours to complete.",https://usa.akshardham.org/visit,,,https://www.google.com/maps/search/?api=1&query=acchamaba%20temple%20Ramakrishnapuram%20temple,"https://www.entertales.com/wp-content/uploads/temple.jpg, https://www.usatoday.com/gcdn/authoring/authoring-images/2023/09/27/PAPP/70985415007-hindu-092723-x.jpg?crop=5183,2916,x0,y539&width=3200&height=1801&format=pjpg&auto=webp"
Sri ganapathi temple,16.4527372,80.6100514,Kolanukonda,Andhra Pradesh,India,Kolanukonda is a suburb of Vijayawada in Guntur district of the Indian state of Andhra Pradesh. It is located in Tadepalle mandal part of Mangalagiri Tadepalle Municipal Corporation part of Guntur revenue division. [4] There is a historical temple on the hill here. It is a Shiva temple and kodanda ramalayam and malchaamma Zenda chettu in tanda,https://en.wikipedia.org/wiki/Kolanukonda,,,https://www.google.com/maps/search/?api=1&query=Sri%20ganapathi%20temple%20Kolanukonda%20temple,"https://media1.thrillophilia.com/filestore/n6id9cn6t3ww7u1bpsi5glqg77z5_ED2aW4wUUAIcaNY.jpg, https://im.whatshot.in/img/2020/Aug/panchamukhi-fb-cropped-1-1598260158.jpg"
GangaLamma temple,16.4472661,80.6107647,Vaddeswaram,Andhra Pradesh,India,"GangaLamma temple is a Hindu temple in Tadepalle, Guntūr District, Andhra Pradesh. Mapcarta, the open map. ... Vaddeswaram is a Suburb of Vijayawada in Guntur district of the Indian state of Andhra Pradesh. It is located at a distance of 5 km from Krishna River, ...",https://mapcarta.com/N5640977730,,,https://www.google.com/maps/search/?api=1&query=GangaLamma%20temple%20Vaddeswaram%20temple,"https://4.bp.blogspot.com/-43eG1ZjRr64/VzN5cUOlhXI/AAAAAAAAg4U/THDPT8vVwmEqOPbEmaasljoU8Aj5PGU6ACLcB/s640/banner1.jpg, https://files.yappe.in/place/small/gangalamma-temple-8561878.webp"
Sri rama temple,16.4478158,80.6135209,Vaddeswaram,Andhra Pradesh,India,"Vadeshwaram Temple is a Shiva temple located at Aroli in the Kannur district of Kerala, India. Vadeshwaram is one among the 108 ancient Shiva temples in Kerala.",https://en.wikipedia.org/wiki/Vadeshwaram_Temple,,,https://www.google.com/maps/search/?api=1&query=Sri%20rama%20temple%20Vaddeswaram%20temple,"https://static.toiimg.com/photo/msid-72007734,width-96,height-65.cms, https://tds.indianeagle.com/wp-content/uploads/2019/12/bhadrachalam.jpg"
Ganganamma temple,16.4472319,80.610902,Vaddeswaram,Andhra Pradesh,India,"GangaLamma temple is situated nearby to the place of worship Church, as well as near the Hindu temple Ganganamma temple. Overview: Map: Satellite: Photo Map: Directions: Hotels: Overview: Map: Satellite: Photo Map: Hotels: Photo Map: Directions: Tap on a place to explore it: ... Vaddeswaram. Town Photo: Vin09, CC BY-SA 4.0.",https://mapcarta.com/N5640977730,,,https://www.google.com/maps/search/?api=1&query=Ganganamma%20temple%20Vaddeswaram%20temple,"https://3.bp.blogspot.com/-L5lWTVG9fvw/XDLnSnGj_UI/AAAAAAABQgw/qK6Wu7J8yIoPV9_sGvz7kPA_pO55QGk4ACEwYBhgL/s1600/WhatsApp+Image+2018-05-30+at+11.35.23+AM.jpeg, https://4.bp.blogspot.com/-PrNH87cAnUo/XDLnSu3UHzI/AAAAAAABQg0/G5CaktbXCHcu6j9YuguMfVfj6PinVVySgCEwYBhgL/s1600/WhatsApp+Image+2018-05-30+at+11.35.31+AM.jpeg"
Human temple,16.4622627,80.6180456,Vaddeswaram,Andhra Pradesh,India,"Vadeshwaram Temple is a Shiva temple located at Aroli in the Kannur district of Kerala, India. Vadeshwaram is one among the 108 ancient Shiva temples in Kerala. It is also well known amongst the numerous Shiva temples in South India. It is built on top of a hill that looks like a mountain and is hence known by the nickname 'Kailasa of North ...",https://en.wikipedia.org/wiki/Vadeshwaram_Temple,,,https://www.google.com/maps/search/?api=1&query=Human%20temple%20Vaddeswaram%20temple,"https://files.yappe.in/place/small/venkateswara-swamy-temple-9450349.webp, https://files.yappe.in/place/small/venkateswara-swamy-temple-9450350.webp"
Anjneya temple,16.4621852,80.6180387,Vaddeswaram,Andhra Pradesh,India,"Anjneya temple is a Hindu temple in Tadepalle, Guntūr District, Andhra Pradesh. Anjneya temple is situated nearby to the Hindu temple Human temple and the place of worship Andhra Ivanjical Lutheran church .",https://mapcarta.com/N5641058623,,,https://www.google.com/maps/search/?api=1&query=Anjneya%20temple%20Vaddeswaram%20temple,"https://1.bp.blogspot.com/-lv1PzB5FLp4/YLDcBStuYvI/AAAAAAAByx8/wEXB4_Jx_YUOBFDLtyTisoLGh_xJrwxgwCLcBGAsYHQ/s1024/2021-04-19+%281%29.jpg, https://www.astroved.com/astropedia/assets/images/temples/Panchavati-Anjaneya-Temple.jpg"
Sri Abhayanjaneya Swamy Temple,16.6355545,80.9717582,Hanuman Junction,Andhra Pradesh,India,"Sri Abhaya Anjaneya Swamy temple can be categorised under Religious places and is a popular tourist place in Hanuman Junction. This Sri Abhaya Anjaneya Swamy temple draws huge crowds from the neighbouring places of Hyderabad, Vizag, Vijayawada, Tirupathi, Srisailam, Karimnagar, Nellore, Warangal, Basara, Kadapa. Some of the other tourist places in the city of Hanuman Junction - Sri Abhaya ...",https://holyshrines.in/sri-abhaya-anjaneya-swamy-temple-hanuman-junction/,,,https://www.google.com/maps/search/?api=1&query=Sri%20Abhayanjaneya%20Swamy%20Temple%20Hanuman%20Junction%20temple,"https://lh5.googleusercontent.com/p/AF1QipMD38zzuWnPAJa0Yzq7AHpz5AHVsOOr-He3FcSi=w1080-k-no, https://lookaside.fbsbx.com/lookaside/crawler/media/?media_id=943617673465672&get_thumbnail=1"
Pata Patnam Ammavaru,18.4686936,84.1292917,Pedda Harichandram,Andhra Pradesh,India,"Harishchandrapuram railway station is a railway station on Khurda Road-Visakhapatnam section, part of the Howrah-Chennai main line under Waltair railway division of East Coast Railway zone. Harishchandrapuram railway station is situated 1½ km northwest of Pata Patnam Ammavaru.",https://mapcarta.com/N5729554943,,,https://www.google.com/maps/search/?api=1&query=Pata%20Patnam%20Ammavaru%20Pedda%20Harichandram%20temple,"http://photos.wikimapia.org/p/00/01/41/10/74_big.jpg, https://tfipost.com/wp-content/uploads/2022/12/Sri_Padmavathi_Ammavari_Temple_entry_gate.jpg"
Asiri Thalli Ammavaru,18.4680642,84.134807,Pedda Harichandram,Andhra Pradesh,India,Sri Pydithalli Ammavaru Temple History The history of the temple dates back to 18th century. Legends say that the goddess Pydimamba belonged to the Gajapati Dynasty and that she was the sister of king Vijaya Rama Raju. During 1756 the king of Vizianagaram had a constant rivalry with the king of Bobbili.,https://andhratemple.blogspot.com/2011/09/sri-pydithalli-ammavaru.html,,,https://www.google.com/maps/search/?api=1&query=Asiri%20Thalli%20Ammavaru%20Pedda%20Harichandram%20temple,"https://www.pujasthan.com/wp-content/uploads/2023/01/Sri-Peddamma-Thalli-Temple-Jubilee-Hills-Hyderabad.jpg, https://1.bp.blogspot.com/-6s5JUFZuddQ/YR0lN-gsZYI/AAAAAAAAyp0/uzrxQPSoArkAVI6bAnuDcqnPxsbPFX3fACNcBGAsYHQ/s1347/Screenshot_20210816-214326_Instagram.jpg"
ammavari gudi,18.4440874,84.1290463,Chinna Venkatapuram,Andhra Pradesh,India,"Sri Padmavathi Ammavari Temple is a renowned Hindu temple located in Tiruchanur, a suburb of Tirupati in Andhra Pradesh, India. Dedicated to Goddess Padmavathi, an incarnation of Goddess Lakshmi and the consort of Lord Venkateswara, this temple holds immense religious significance. It is a key pilgrimage destination, attracting millions of ...",https://eindiatourism.in/sri-padmavathi-ammavari-temple/,,,https://www.google.com/maps/search/?api=1&query=ammavari%20gudi%20Chinna%20Venkatapuram%20temple,"https://i.pinimg.com/originals/e6/4a/9d/e64a9d2bab0202c2d51f2186d238cf69.jpg, http://templesinindiainfo.com/wp-content/uploads/2017/01/Vemavaram-Sri-Kondalamma-Ammavari-Temple.jpg"
jai santoshi ma temple,18.6056322,84.2318017,Tekkali,Andhra Pradesh,India,jai santoshi ma temple is a Hindu temple in Andhra Pradesh. jai santoshi ma temple is situated nearby to the railway stop Tekkali Halt railway station and the Hindu temple sri sri sri kasi vishveswara temple.,https://mapcarta.com/N5734606371,,,https://www.google.com/maps/search/?api=1&query=jai%20santoshi%20ma%20temple%20Tekkali%20temple,"https://1.bp.blogspot.com/-fPpK0P3EJ6Q/UUWW_DNb-BI/AAAAAAAAI70/gHfZj-fXs8c/s1600/Jai+Santoshi+Maa+7.gif, https://lh5.googleusercontent.com/p/AF1QipMZznUvUBS0MRMTnHcIMRTEgifS2a9bEwdawACe=w1080-k-no"
sri sri sri kasi vishveswara temple,18.6085919,84.2332413,Tekkali,Andhra Pradesh,India,Arulmigu Kasi Visvanatha Swamy Temple is located in a busy locality in Tenkasi. The full name of the Temple is Sri Ulagamman Udanurai Sri Kasi Viswanathar Temple. Devotees may have to climb 5 to 6 steps to reach the Temple entrance and they have kept two Elephant Idols on either side of these steps.,https://www.visittemples.com/hindu/srikasiviswanathartempletenkasitamilnadu,,,https://www.google.com/maps/search/?api=1&query=sri%20sri%20sri%20kasi%20vishveswara%20temple%20Tekkali%20temple,"https://www.trawell.in/admin/images/upload/573455325Tirupati_BuggaAgraharam_Main.jpg, https://3.bp.blogspot.com/-y2S_0tue8ms/VPY7_nzkyoI/AAAAAAAAKd4/WOOzvQCuTqo/s1600/Kasi+Vishwanatha+Temple+1.jpg"
durga malleswara swamy temple,18.6120126,84.2343927,Tekkali,Andhra Pradesh,India,"sri durga malleswara swamy varla devasthanam, 10-19-54/5, BHRAMINSTREET, VIJAYAWADA, Krishna, Andhra Pradesh, 520001 +91 9441820717",https://durgamalleswaraswamy.com/,,+91 9441820717,https://www.google.com/maps/search/?api=1&query=durga%20malleswara%20swamy%20temple%20Tekkali%20temple,"https://kanakadurgamma.org/static/media/IMG-20220413-WA0018@2x.7f356c08.png, https://www.touristplaces.net.in/images/pp/5/p115383.jpg"
